<!ELEMENT loadMap (attributeMap+)>
<!ATTLIST loadMap
          cim_name CDATA #REQUIRED
          name CDATA #REQUIRED
          package CDATA #REQUIRED
          rfd_id CDATA #REQUIRED
          stereotype CDATA #REQUIRED>
<!ELEMENT attributeMap (#PCDATA)>
<!ATTLIST attributeMap
          cim_name CDATA #REQUIRED
          datatype CDATA #REQUIRED
          mo_name CDATA #REQUIRED
          variability CDATA #REQUIRED
          visibility CDATA #REQUIRED>
